{
  "schemaVersion": "0.2",
  "direction": "oklm-to-keylayout",
  "source": {
    "format": "oklm",
    "file": "azerty-afnor.oklm.json",
    "version": "0.2"
  },
  "target": {
    "format": "apple-keylayout"
  },
  "compatibilityLevel": "lossy-mapping",
  "mappedFields": [
    "keys",
    "keys[].levels",
    "levelSelectors",
    "deadKeys"
  ],
  "skippedFields": [
    {
      "path": "layoutId",
      "reason": "no macOS keylayout attribute for this OKLM identity/provenance field in the v1 exporter"
    },
    {
      "path": "authors",
      "reason": "no macOS keylayout attribute for this OKLM identity/provenance field in the v1 exporter"
    },
    {
      "path": "license",
      "reason": "no macOS keylayout attribute for this OKLM identity/provenance field in the v1 exporter"
    },
    {
      "path": "locales",
      "reason": "macOS keylayout files are not locale-tagged; only the layout name is used"
    },
    {
      "path": "description",
      "reason": "free-text description, not part of any target's mapping model"
    },
    {
      "path": "conformance",
      "reason": "OKLM conformance claims are not expressed by target formats"
    },
    {
      "path": "exports",
      "reason": "OKLM export declarations are input to this tooling, not output data"
    },
    {
      "path": "metadata",
      "reason": "OKLM metadata envelope (pedagogy, AI, accessibility, links) has no target equivalent"
    }
  ],
  "lossyMappings": [
    {
      "path": "levelSelectors.Level3Shift",
      "detail": "exported as macOS modifier 'anyOption'; actual physical binding (AltGr vs Ctrl+Alt vs macOS Option) is platform-specific per SPEC.md"
    },
    {
      "path": "deadKeys[acute]",
      "detail": "no 'fallback' or 'display' declared; the built-in terminator character of the exporter is used (macOS output of the dead key pressed then a non-composing key)"
    },
    {
      "path": "deadKeys[breve]",
      "detail": "no 'fallback' or 'display' declared; the built-in terminator character of the exporter is used (macOS output of the dead key pressed then a non-composing key)"
    },
    {
      "path": "deadKeys[caron]",
      "detail": "no 'fallback' or 'display' declared; the built-in terminator character of the exporter is used (macOS output of the dead key pressed then a non-composing key)"
    },
    {
      "path": "deadKeys[cedilla]",
      "detail": "no 'fallback' or 'display' declared; the built-in terminator character of the exporter is used (macOS output of the dead key pressed then a non-composing key)"
    },
    {
      "path": "deadKeys[circumflex]",
      "detail": "no 'fallback' or 'display' declared; the built-in terminator character of the exporter is used (macOS output of the dead key pressed then a non-composing key)"
    },
    {
      "path": "deadKeys[comma]",
      "detail": "no 'fallback' or 'display' declared; the built-in terminator character of the exporter is used (macOS output of the dead key pressed then a non-composing key)"
    },
    {
      "path": "deadKeys[currencies]",
      "detail": "no 'fallback' or 'display' declared; the built-in terminator character of the exporter is used (macOS output of the dead key pressed then a non-composing key)"
    },
    {
      "path": "deadKeys[diaeresis]",
      "detail": "no 'fallback' or 'display' declared; the built-in terminator character of the exporter is used (macOS output of the dead key pressed then a non-composing key)"
    },
    {
      "path": "deadKeys[dot-above]",
      "detail": "no 'fallback' or 'display' declared; the built-in terminator character of the exporter is used (macOS output of the dead key pressed then a non-composing key)"
    },
    {
      "path": "deadKeys[dot-below]",
      "detail": "no 'fallback' or 'display' declared; the built-in terminator character of the exporter is used (macOS output of the dead key pressed then a non-composing key)"
    },
    {
      "path": "deadKeys[double-acute]",
      "detail": "no 'fallback' or 'display' declared; the built-in terminator character of the exporter is used (macOS output of the dead key pressed then a non-composing key)"
    },
    {
      "path": "deadKeys[double-grave]",
      "detail": "no 'fallback' or 'display' declared; the built-in terminator character of the exporter is used (macOS output of the dead key pressed then a non-composing key)"
    },
    {
      "path": "deadKeys[extended-latin]",
      "detail": "no 'fallback' or 'display' declared; the built-in terminator character of the exporter is used (macOS output of the dead key pressed then a non-composing key)"
    },
    {
      "path": "deadKeys[grave]",
      "detail": "no 'fallback' or 'display' declared; the built-in terminator character of the exporter is used (macOS output of the dead key pressed then a non-composing key)"
    },
    {
      "path": "deadKeys[greek]",
      "detail": "no 'fallback' or 'display' declared; the built-in terminator character of the exporter is used (macOS output of the dead key pressed then a non-composing key)"
    },
    {
      "path": "deadKeys[horizontal-stroke]",
      "detail": "no 'fallback' or 'display' declared; the built-in terminator character of the exporter is used (macOS output of the dead key pressed then a non-composing key)"
    },
    {
      "path": "deadKeys[inverted-breve]",
      "detail": "no 'fallback' or 'display' declared; the built-in terminator character of the exporter is used (macOS output of the dead key pressed then a non-composing key)"
    },
    {
      "path": "deadKeys[macron]",
      "detail": "no 'fallback' or 'display' declared; the built-in terminator character of the exporter is used (macOS output of the dead key pressed then a non-composing key)"
    },
    {
      "path": "deadKeys[ogonek]",
      "detail": "no 'fallback' or 'display' declared; the built-in terminator character of the exporter is used (macOS output of the dead key pressed then a non-composing key)"
    },
    {
      "path": "deadKeys[ring-above]",
      "detail": "no 'fallback' or 'display' declared; the built-in terminator character of the exporter is used (macOS output of the dead key pressed then a non-composing key)"
    },
    {
      "path": "deadKeys[stroke]",
      "detail": "no 'fallback' or 'display' declared; the built-in terminator character of the exporter is used (macOS output of the dead key pressed then a non-composing key)"
    },
    {
      "path": "deadKeys[tilde]",
      "detail": "no 'fallback' or 'display' declared; the built-in terminator character of the exporter is used (macOS output of the dead key pressed then a non-composing key)"
    },
    {
      "path": "geometry",
      "detail": "the <layouts> hardware-detection range is not modeled per OKLM geometry in v1; the generic first=0 last=17 mapSet=ANSI range from Apple's reference example is used"
    }
  ],
  "warnings": [],
  "errors": [],
  "generator": {
    "name": "oklm-exporters",
    "version": "0.2"
  },
  "roundTripConfidence": "medium"
}
