{
  "schemaVersion": "0.2",
  "direction": "oklm-to-xkb",
  "source": {
    "format": "oklm",
    "file": "bepo.oklm.json",
    "version": "0.2"
  },
  "target": {
    "format": "xkb-symbols"
  },
  "compatibilityLevel": "lossy-mapping",
  "mappedFields": [
    "keys",
    "keys[].levels"
  ],
  "skippedFields": [
    {
      "path": "keys[].levels.5",
      "reason": "xkb key symbol lists support at most 4 shift levels per key (FOUR_LEVEL key types); CapsLock-conditioned levels are handled by the X server via key type and locale ctype rules, not per-key declarations"
    },
    {
      "path": "keys[].levels.6",
      "reason": "xkb key symbol lists support at most 4 shift levels per key (FOUR_LEVEL key types); CapsLock-conditioned levels are handled by the X server via key type and locale ctype rules, not per-key declarations"
    },
    {
      "path": "keys[].levels.7",
      "reason": "xkb key symbol lists support at most 4 shift levels per key (FOUR_LEVEL key types); CapsLock-conditioned levels are handled by the X server via key type and locale ctype rules, not per-key declarations"
    },
    {
      "path": "keys[].levels.8",
      "reason": "xkb key symbol lists support at most 4 shift levels per key (FOUR_LEVEL key types); CapsLock-conditioned levels are handled by the X server via key type and locale ctype rules, not per-key declarations"
    },
    {
      "path": "deadKeys[superscript]",
      "reason": "no xkb dead_* keysym equivalent and no display fallback available"
    },
    {
      "path": "description",
      "reason": "free-text description, not part of any target's mapping model"
    },
    {
      "path": "conformance",
      "reason": "OKLM conformance claims are not expressed by target formats"
    },
    {
      "path": "exports",
      "reason": "OKLM export declarations are input to this tooling, not output data"
    },
    {
      "path": "metadata",
      "reason": "OKLM metadata envelope (pedagogy, AI, accessibility, links) has no target equivalent"
    },
    {
      "path": "layoutId",
      "reason": "no xkb_symbols construct for this OKLM identity/provenance field in the v1 exporter"
    },
    {
      "path": "authors",
      "reason": "no xkb_symbols construct for this OKLM identity/provenance field in the v1 exporter"
    },
    {
      "path": "license",
      "reason": "no xkb_symbols construct for this OKLM identity/provenance field in the v1 exporter"
    },
    {
      "path": "locales",
      "reason": "no xkb_symbols construct for this OKLM identity/provenance field in the v1 exporter"
    },
    {
      "path": "levelSelectors",
      "reason": "no xkb_symbols construct for this OKLM identity/provenance field in the v1 exporter"
    }
  ],
  "lossyMappings": [
    {
      "path": "deadKeys[].compositions",
      "detail": "compositions are re-emitted as XCompose rules in the companion .XCompose file, which must be installed (~/.XCompose or merged into the system Compose configuration) for the dead keys to give the OKLM results; carrier dead_* keysyms (e.g. dead_belowring for horizontal-stroke) have no native composition meaning; dead keys without any dead_* keysym lose their compositions"
    }
  ],
  "warnings": [],
  "errors": [],
  "generator": {
    "name": "oklm-exporters",
    "version": "0.2"
  },
  "roundTripConfidence": "medium"
}
