{
  "schemaVersion": "0.2",
  "direction": "oklm-to-ldml",
  "source": {
    "format": "oklm",
    "file": "qwerty-us.oklm.json",
    "version": "0.2"
  },
  "target": {
    "format": "ldml-keyboard-3"
  },
  "compatibilityLevel": "lossy-mapping",
  "mappedFields": [
    "locales",
    "keys",
    "keys[].levels",
    "levelSelectors"
  ],
  "skippedFields": [
    {
      "path": "layoutId",
      "reason": "no LDML info attribute for this OKLM identity/provenance field in the v1 exporter"
    },
    {
      "path": "authors",
      "reason": "no LDML info attribute for this OKLM identity/provenance field in the v1 exporter"
    },
    {
      "path": "license",
      "reason": "no LDML info attribute for this OKLM identity/provenance field in the v1 exporter"
    },
    {
      "path": "description",
      "reason": "free-text description, not part of any target's mapping model"
    },
    {
      "path": "conformance",
      "reason": "OKLM conformance claims are not expressed by target formats"
    },
    {
      "path": "exports",
      "reason": "OKLM export declarations are input to this tooling, not output data"
    },
    {
      "path": "metadata",
      "reason": "OKLM metadata envelope (pedagogy, AI, accessibility, links) has no target equivalent"
    }
  ],
  "lossyMappings": [
    {
      "path": "locales",
      "detail": "only the primary locale 'en' is exported; LDML keyboard3 declares one locale"
    }
  ],
  "warnings": [],
  "errors": [],
  "generator": {
    "name": "oklm-exporters",
    "version": "0.2"
  },
  "roundTripConfidence": "medium"
}
