{
  "schemaVersion": "0.2",
  "direction": "oklm-to-klc",
  "source": {
    "format": "oklm",
    "file": "azerty-global.oklm.json",
    "version": "0.2"
  },
  "target": {
    "format": "windows-klc"
  },
  "compatibilityLevel": "lossy-mapping",
  "mappedFields": [
    "keys",
    "keys[].levels",
    "levelSelectors",
    "deadKeys"
  ],
  "skippedFields": [
    {
      "path": "geometry",
      "reason": "not represented in .klc (the short name comes from layoutId)"
    },
    {
      "path": "layoutId",
      "reason": "not represented in .klc (the short name comes from layoutId)"
    },
    {
      "path": "version",
      "reason": "not represented in .klc (the short name comes from layoutId)"
    },
    {
      "path": "description",
      "reason": "free-text description, not part of any target's mapping model"
    },
    {
      "path": "conformance",
      "reason": "OKLM conformance claims are not expressed by target formats"
    },
    {
      "path": "exports",
      "reason": "OKLM export declarations are input to this tooling, not output data"
    },
    {
      "path": "metadata",
      "reason": "OKLM metadata envelope (pedagogy, AI, accessibility, links) has no target equivalent"
    }
  ],
  "lossyMappings": [
    {
      "path": "deadKeys[dot-below]",
      "detail": "no usable standalone character: private-use U+E000 names the DEADKEY and would be typed if the sequence does not compose"
    },
    {
      "path": "deadKeys[double-grave]",
      "detail": "no usable standalone character: private-use U+E001 names the DEADKEY and would be typed if the sequence does not compose"
    },
    {
      "path": "deadKeys[horn]",
      "detail": "no usable standalone character: private-use U+E002 names the DEADKEY and would be typed if the sequence does not compose"
    },
    {
      "path": "deadKeys[hook]",
      "detail": "no usable standalone character: private-use U+E003 names the DEADKEY and would be typed if the sequence does not compose"
    },
    {
      "path": "deadKeys[inverted-breve]",
      "detail": "no usable standalone character: private-use U+E004 names the DEADKEY and would be typed if the sequence does not compose"
    },
    {
      "path": "deadKeys[stroke]",
      "detail": "no usable standalone character: private-use U+E005 names the DEADKEY and would be typed if the sequence does not compose"
    },
    {
      "path": "deadKeys[horizontal-stroke]",
      "detail": "no usable standalone character: private-use U+E006 names the DEADKEY and would be typed if the sequence does not compose"
    },
    {
      "path": "deadKeys[extended-latin]",
      "detail": "no usable standalone character: private-use U+E007 names the DEADKEY and would be typed if the sequence does not compose"
    },
    {
      "path": "deadKeys[comma]",
      "detail": "no usable standalone character: private-use U+E008 names the DEADKEY and would be typed if the sequence does not compose"
    },
    {
      "path": "deadKeys[phonetic]",
      "detail": "no usable standalone character: private-use U+E009 names the DEADKEY and would be typed if the sequence does not compose"
    },
    {
      "path": "deadKeys[greek]",
      "detail": "no usable standalone character: private-use U+E00A names the DEADKEY and would be typed if the sequence does not compose"
    },
    {
      "path": "deadKeys[cyrillic]",
      "detail": "no usable standalone character: private-use U+E00B names the DEADKEY and would be typed if the sequence does not compose"
    },
    {
      "path": "deadKeys[misc-symbols]",
      "detail": "no usable standalone character: private-use U+E00C names the DEADKEY and would be typed if the sequence does not compose"
    },
    {
      "path": "deadKeys[scientific]",
      "detail": "no usable standalone character: private-use U+E00D names the DEADKEY and would be typed if the sequence does not compose"
    },
    {
      "path": "deadKeys[currencies]",
      "detail": "no usable standalone character: private-use U+E00E names the DEADKEY and would be typed if the sequence does not compose"
    },
    {
      "path": "deadKeys[punctuation]",
      "detail": "no usable standalone character: private-use U+E00F names the DEADKEY and would be typed if the sequence does not compose"
    },
    {
      "path": "keys[E02].levels",
      "detail": "CapsLock behaviour on states 0/1 is neither 'no effect' nor 'swap': needs SGCap, ignored"
    },
    {
      "path": "keys[E07].levels",
      "detail": "CapsLock behaviour on states 0/1 is neither 'no effect' nor 'swap': needs SGCap, ignored"
    },
    {
      "path": "keys[E09].levels",
      "detail": "CapsLock behaviour on states 0/1 is neither 'no effect' nor 'swap': needs SGCap, ignored"
    },
    {
      "path": "keys[E10].levels",
      "detail": "CapsLock behaviour on states 0/1 is neither 'no effect' nor 'swap': needs SGCap, ignored"
    },
    {
      "path": "keys[].levels",
      "detail": "Ctrl column filled with the standard control codes; CapsLock reduced to the Cap column"
    }
  ],
  "warnings": [
    "MSKLC was not available: the .klc was never compiled; it is checked by an in-repo parser only"
  ],
  "errors": [],
  "generator": {
    "name": "oklm-exporters",
    "version": "0.2"
  },
  "roundTripConfidence": "low"
}
